==START TEST==
CPU:
   0x00000000 0x00: eax=0x0000000d ebx=0x68747541 ecx=0x444d4163 edx=0x69746e65
   0x00000001 0x00: eax=0x00800f12 ebx=0x00000800 ecx=0xf6d8320b edx=0x078bfbfd
   0x00000002 0x00: eax=0x00000001 ebx=0x00000000 ecx=0x0000004b edx=0x002cff80
   0x00000003 0x00: eax=0x00000000 ebx=0x00000000 ecx=0x00000000 edx=0x00000000
   0x00000004 0x00: eax=0x00000121 ebx=0x01c0003f ecx=0x0000003f edx=0x00000001
   0x00000004 0x01: eax=0x00000122 ebx=0x00c0003f ecx=0x000000ff edx=0x00000001
   0x00000004 0x02: eax=0x00000043 ebx=0x01c0003f ecx=0x000003ff edx=0x00000000
   0x00000004 0x03: eax=0x00000163 ebx=0x03c0003f ecx=0x00001fff edx=0x00000006
   0x00000005 0x00: eax=0x00000000 ebx=0x00000000 ecx=0x00000003 edx=0x00000000
   0x00000006 0x00: eax=0x00000004 ebx=0x00000000 ecx=0x00000000 edx=0x00000000
   0x00000007 0x00: eax=0x00000000 ebx=0x209c01a9 ecx=0x00000000 edx=0x00000000
   0x00000009 0x00: eax=0x00000000 ebx=0x00000000 ecx=0x00000000 edx=0x00000000
   0x0000000a 0x00: eax=0x00000000 ebx=0x00000000 ecx=0x00000000 edx=0x00000000
   0x0000000b 0x00: eax=0x00000000 ebx=0x00000001 ecx=0x00000100 edx=0x00000000
   0x0000000c 0x00: eax=0x00000000 ebx=0x00000000 ecx=0x00000000 edx=0x00000000
   0x0000000d 0x00: eax=0x00000007 ebx=0x00000240 ecx=0x00000340 edx=0x00000000
   0x0000000d 0x01: eax=0x00000007 ebx=0x00000000 ecx=0x00000000 edx=0x00000000
   0x0000000d 0x02: eax=0x00000100 ebx=0x00000240 ecx=0x00000000 edx=0x00000000
   0x0000000d 0x03: eax=0x00000000 ebx=0x00000000 ecx=0x00000000 edx=0x00000000
   0x0000000d 0x04: eax=0x00000000 ebx=0x00000000 ecx=0x00000000 edx=0x00000000
   0x0000000d 0x05: eax=0x00000000 ebx=0x00000000 ecx=0x00000000 edx=0x00000000
   0x0000000d 0x06: eax=0x00000000 ebx=0x00000000 ecx=0x00000000 edx=0x00000000
   0x0000000d 0x07: eax=0x00000000 ebx=0x00000000 ecx=0x00000000 edx=0x00000000
   0x80000000 0x00: eax=0x8000001e ebx=0x68747541 ecx=0x444d4163 edx=0x69746e65
   0x80000001 0x00: eax=0x00800f12 ebx=0x00000000 ecx=0x004003f5 edx=0x2fd3fbfd
   0x80000002 0x00: eax=0x20444d41 ebx=0x43595045 ecx=0x6f725020 edx=0x73736563
   0x80000003 0x00: eax=0x2820726f ebx=0x68746977 ecx=0x50424920 edx=0x00002942
   0x80000004 0x00: eax=0x00000000 ebx=0x00000000 ecx=0x00000000 edx=0x00000000
   0x80000005 0x00: eax=0x01ff01ff ebx=0x01ff01ff ecx=0x20080140 edx=0x40040140
   0x80000006 0x00: eax=0x00000000 ebx=0x42004200 ecx=0x02006140 edx=0x00408140
   0x80000007 0x00: eax=0x00000000 ebx=0x00000000 ecx=0x00000000 edx=0x00000000
   0x80000008 0x00: eax=0x00003028 ebx=0x00001000 ecx=0x00000000 edx=0x00000000
   0x8000000a 0x00: eax=0x00000001 ebx=0x00000010 ecx=0x00000000 edx=0x00000009
   0xc0000000 0x00: eax=0x00000007 ebx=0x00000240 ecx=0x00000340 edx=0x00000000
==END TEST==
